source	native	name	p_value	significant	description	term_size	query_size	intersection_size	effective_domain_size	precision	recall	query	parents	intersections	evidences
GO:BP	GO:0035995	detection of muscle stretch	0.0020181045600891137	True	"""The series of events by which a muscle stretch stimulus is received by a cell and converted into a molecular signal."" [PMID:14583192]"	7	7	2	21110	0.2857142857142857	0.2857142857142857	CoGs	['GO:0035994', 'GO:0050982']	['ENSG00000182533', 'ENSG00000155657']	[['ISS', 'IEA'], ['IDA', 'TAS']]
GO:BP	GO:0006936	muscle contraction	0.002299433556931029	True	"""A process in which force is generated within muscle tissue, resulting in a change in muscle geometry. Force generation involves a chemo-mechanical energy conversion step that is carried out by the actin/myosin complex activity, which generates force through ATP hydrolysis."" [GOC:ef, GOC:mtg_muscle, ISBN:0198506732]"	341	7	4	21110	0.5714285714285714	0.011730205278592375	CoGs	['GO:0003012']	['ENSG00000182533', 'ENSG00000175084', 'ENSG00000120729', 'ENSG00000155657']	[['IMP', 'ISS', 'IEA'], ['TAS'], ['TAS'], ['IMP', 'TAS', 'NAS']]
GO:BP	GO:0033292	T-tubule organization	0.00345851513996958	True	"""A process that is carried out at the cellular level that results in the assembly, arrangement of constituent parts, or disassembly of the T-tubule. A T-tubule is an invagination of the plasma membrane of a muscle cell that extends inward from the cell surface around each myofibril."" [GOC:dph, GOC:jl, GOC:mah]"	9	7	2	21110	0.2857142857142857	0.2222222222222222	CoGs	['GO:0007009', 'GO:0055001', 'GO:0061024']	['ENSG00000182533', 'ENSG00000135636']	[['TAS'], ['IBA']]
GO:BP	GO:0003012	muscle system process	0.005565729302876866	True	"""A organ system process carried out at the level of a muscle. Muscle tissue is composed of contractile cells or fibers."" [GOC:mtg_cardio]"	426	7	4	21110	0.5714285714285714	0.009389671361502348	CoGs	['GO:0003008']	['ENSG00000182533', 'ENSG00000175084', 'ENSG00000120729', 'ENSG00000155657']	[['IMP', 'ISS', 'IEA'], ['TAS'], ['TAS'], ['IMP', 'TAS', 'NAS']]
GO:BP	GO:0055001	muscle cell development	0.023800001855507402	True	"""The process whose specific outcome is the progression of a muscle cell over time, from its formation to the mature structure. Muscle cell development does not include the steps involved in committing an unspecified cell to the muscle cell fate."" [CL:0000187, GOC:devbiol]"	187	7	3	21110	0.42857142857142855	0.016042780748663103	CoGs	['GO:0042692', 'GO:0048468']	['ENSG00000182533', 'ENSG00000135636', 'ENSG00000155657']	[['IMP', 'TAS', 'IEA'], ['IBA'], ['IMP']]
GO:BP	GO:0035994	response to muscle stretch	0.03113897147950516	True	"""Any process that results in a change in state or activity of a cell or an organism (in terms of movement, secretion, enzyme production, gene expression, etc.) as a result of a myofibril being extended beyond its slack length."" [GOC:BHF, GOC:vk, PMID:14583192]"	26	7	2	21110	0.2857142857142857	0.07692307692307693	CoGs	['GO:0009612']	['ENSG00000182533', 'ENSG00000155657']	[['ISS', 'IEA'], ['IDA', 'TAS']]
GO:BP	GO:0061061	muscle structure development	0.03212030931581733	True	"""The progression of a muscle structure over time, from its formation to its mature state. Muscle structures are contractile cells, tissues or organs that are found in multicellular organisms."" [GOC:dph]"	664	7	4	21110	0.5714285714285714	0.006024096385542169	CoGs	['GO:0048856']	['ENSG00000182533', 'ENSG00000175084', 'ENSG00000135636', 'ENSG00000155657']	[['IMP', 'TAS', 'IEA'], ['IBA'], ['IBA'], ['IMP']]
GO:BP	GO:0001778	plasma membrane repair	0.04747783176454124	True	"""The resealing of a cell plasma membrane after cellular wounding due to, for instance, mechanical stress."" [GOC:add, PMID:12925704]"	32	7	2	21110	0.2857142857142857	0.0625	CoGs	['GO:0007009', 'GO:0042060']	['ENSG00000182533', 'ENSG00000135636']	[['IEA'], ['IBA']]
